{
  "schema_version": 1,
  "id": "run-fixture-004",
  "campaign_id": "campaign-fixture-004",
  "plan_version": 1,
  "seed": "campaign-fixture-004:v1",
  "input_fingerprint": "aaaaaaaaaaaaaaaaaaaaaaaaaaaaaaaaaaaaaaaaaaaaaaaaaaaaaaaaaaaaaaaa",
  "status": "review",
  "requested_by": "operator-fixture",
  "created_at": "2026-07-19T00:00:00.000Z",
  "started_at": "2026-07-19T00:00:01.000Z",
  "completed_at": "2026-07-19T00:05:00.000Z"
}
